{
  "actor": "audit-wales",
  "actor_name": "Audit Wales",
  "added_on": "2026-07-16",
  "discipline": "osint_feed",
  "domain": "audit.wales",
  "feed_url": "https://www.audit.wales/rss.xml",
  "id": "audit-wales",
  "lane": "governance-capacity",
  "lane_name": "Governance and capacity",
  "last_productive_run": "20260901T0900Z-0000",
  "last_run_with_hits": "20261004T0900Z-0000",
  "lens": "government",
  "name": "Audit Wales",
  "notes": "Value-for-money and delivery scrutiny of Welsh public bodies; RSS feed verified working 2026-07-17",
  "promoted": 1,
  "promotion_rate": 0.25,
  "raw_hits": 4,
  "reading": "earning_its_place",
  "reliability": "B",
  "reliability_label": "usually reliable",
  "site_pass": true,
  "status": "active",
  "trusted": true,
  "unique_candidates": 4
}
